[
 {
  "key": "#year",
  "type": "VarDecl",
  "range": {
   "sl": 3,
   "sc": 0,
   "el": 3,
   "ec": 30
  },
  "selectionRange": {
   "sl": 3,
   "sc": 18,
   "el": 3,
   "ec": 22
  },
  "bcom": false,
  "xcom": false
 },
 {
  "key": "#base",
  "type": "VarDecl",
  "range": {
   "sl": 3,
   "sc": 31,
   "el": 5,
   "ec": 63
  },
  "selectionRange": {
   "sl": 5,
   "sc": 18,
   "el": 5,
   "ec": 22
  },
  "bcom": true,
  "xcom": true
 },
 {
  "key": "#folders",
  "type": "VarDecl",
  "range": {
   "sl": 6,
   "sc": 0,
   "el": 6,
   "ec": 96
  },
  "selectionRange": {
   "sl": 6,
   "sc": 18,
   "el": 6,
   "ec": 25
  },
  "bcom": false,
  "xcom": false
 },
 {
  "key": "http://www.w3.org/2005/xquery-local-functions#extract#2",
  "type": "FunctionDecl",
  "range": {
   "sl": 11,
   "sc": 0,
   "el": 17,
   "ec": 1
  },
  "selectionRange": {
   "sl": 11,
   "sc": 17,
   "el": 11,
   "ec": 30
  },
  "bcom": true,
  "xcom": true
 },
 {
  "key": "http://www.w3.org/2005/xquery-local-functions#date-wrong#2",
  "type": "FunctionDecl",
  "range": {
   "sl": 22,
   "sc": 0,
   "el": 32,
   "ec": 1
  },
  "selectionRange": {
   "sl": 22,
   "sc": 17,
   "el": 22,
   "ec": 33
  },
  "bcom": true,
  "xcom": true
 },
 {
  "key": "http://www.w3.org/2005/xquery-local-functions#move#2",
  "type": "FunctionDecl",
  "range": {
   "sl": 35,
   "sc": 0,
   "el": 40,
   "ec": 1
  },
  "selectionRange": {
   "sl": 35,
   "sc": 17,
   "el": 35,
   "ec": 27
  },
  "bcom": true,
  "xcom": true
 },
 {
  "key": "http://www.w3.org/2005/xquery-local-functions#print#2",
  "type": "FunctionDecl",
  "range": {
   "sl": 42,
   "sc": 0,
   "el": 46,
   "ec": 1
  },
  "selectionRange": {
   "sl": 42,
   "sc": 17,
   "el": 42,
   "ec": 28
  },
  "bcom": false,
  "xcom": false
 },
 {
  "key": "http://www.w3.org/2005/xquery-local-functions#do#1",
  "type": "FunctionDecl",
  "range": {
   "sl": 48,
   "sc": 0,
   "el": 57,
   "ec": 1
  },
  "selectionRange": {
   "sl": 48,
   "sc": 17,
   "el": 48,
   "ec": 25
  },
  "bcom": false,
  "xcom": false
 },
 {
  "key": "QueryBody",
  "type": "QueryBody",
  "range": {
   "sl": 60,
   "sc": 0,
   "el": 63,
   "ec": 30
  },
  "selectionRange": {
   "sl": 60,
   "sc": 0,
   "el": 63,
   "ec": 30
  }
 }
]
